{
  "schema_version": 2,
  "accepted_rc": {
    "tag": "v0.2.0-rc.1",
    "version": "0.2.0-rc.1",
    "commit": "85440d6577ab12a8c087c1c0919d896503164dc3",
    "artifacts": [
      {
        "target": "aarch64-apple-darwin",
        "archive": "herdr-mise-v0.2.0-rc.1-aarch64-apple-darwin.tar.gz",
        "sha256": "e4cf8c06845a8fe764042b38816004aa4e23e5abed209f2245ea3b00ec2b9b57",
        "archive_url": "https://github.com/funsaized/herdr-mise/releases/download/v0.2.0-rc.1/herdr-mise-v0.2.0-rc.1-aarch64-apple-darwin.tar.gz",
        "checksum_url": "https://github.com/funsaized/herdr-mise/releases/download/v0.2.0-rc.1/herdr-mise-v0.2.0-rc.1-aarch64-apple-darwin.tar.gz.sha256"
      },
      {
        "target": "x86_64-apple-darwin",
        "archive": "herdr-mise-v0.2.0-rc.1-x86_64-apple-darwin.tar.gz",
        "sha256": "bad9caf8073a9bfc2a580d537a22de7968a8a6e37f29f711470bf61db121faf8",
        "archive_url": "https://github.com/funsaized/herdr-mise/releases/download/v0.2.0-rc.1/herdr-mise-v0.2.0-rc.1-x86_64-apple-darwin.tar.gz",
        "checksum_url": "https://github.com/funsaized/herdr-mise/releases/download/v0.2.0-rc.1/herdr-mise-v0.2.0-rc.1-x86_64-apple-darwin.tar.gz.sha256"
      },
      {
        "target": "x86_64-unknown-linux-gnu",
        "archive": "herdr-mise-v0.2.0-rc.1-x86_64-unknown-linux-gnu.tar.gz",
        "sha256": "bbcb6ab7cf31216313b42692cbb9a3025cdf35e692787e2340ea13b22e116229",
        "archive_url": "https://github.com/funsaized/herdr-mise/releases/download/v0.2.0-rc.1/herdr-mise-v0.2.0-rc.1-x86_64-unknown-linux-gnu.tar.gz",
        "checksum_url": "https://github.com/funsaized/herdr-mise/releases/download/v0.2.0-rc.1/herdr-mise-v0.2.0-rc.1-x86_64-unknown-linux-gnu.tar.gz.sha256"
      }
    ]
  },
  "promotion": {
    "tag": "v0.2.0",
    "version": "0.2.0",
    "commit": "0000000000000000000000000000000000000000"
  },
  "gates": [
    {
      "gate_id": "validate-release",
      "category": "automated",
      "scope": "full-product",
      "tester": "release-automation",
      "platform": "REPLACE_WITH_OS_AND_ARCH",
      "executed_against": {
        "tag": "v0.2.0-rc.1",
        "version": "0.2.0-rc.1",
        "commit": "85440d6577ab12a8c087c1c0919d896503164dc3",
        "artifacts": [
          {
            "target": "aarch64-apple-darwin",
            "archive": "herdr-mise-v0.2.0-rc.1-aarch64-apple-darwin.tar.gz",
            "sha256": "e4cf8c06845a8fe764042b38816004aa4e23e5abed209f2245ea3b00ec2b9b57"
          },
          {
            "target": "x86_64-apple-darwin",
            "archive": "herdr-mise-v0.2.0-rc.1-x86_64-apple-darwin.tar.gz",
            "sha256": "bad9caf8073a9bfc2a580d537a22de7968a8a6e37f29f711470bf61db121faf8"
          },
          {
            "target": "x86_64-unknown-linux-gnu",
            "archive": "herdr-mise-v0.2.0-rc.1-x86_64-unknown-linux-gnu.tar.gz",
            "sha256": "bbcb6ab7cf31216313b42692cbb9a3025cdf35e692787e2340ea13b22e116229"
          }
        ]
      },
      "command_or_action": "npm run validate:release",
      "result": "NOT_RUN",
      "timestamp": "1970-01-01T00:00:00Z",
      "evidence_ref": "external://NOT_RUN"
    },
    {
      "gate_id": "perf",
      "category": "automated",
      "scope": "full-product",
      "tester": "release-automation",
      "platform": "REPLACE_WITH_OS_AND_ARCH",
      "executed_against": {
        "tag": "v0.2.0-rc.1",
        "version": "0.2.0-rc.1",
        "commit": "85440d6577ab12a8c087c1c0919d896503164dc3",
        "artifacts": [
          {
            "target": "aarch64-apple-darwin",
            "archive": "herdr-mise-v0.2.0-rc.1-aarch64-apple-darwin.tar.gz",
            "sha256": "e4cf8c06845a8fe764042b38816004aa4e23e5abed209f2245ea3b00ec2b9b57"
          },
          {
            "target": "x86_64-apple-darwin",
            "archive": "herdr-mise-v0.2.0-rc.1-x86_64-apple-darwin.tar.gz",
            "sha256": "bad9caf8073a9bfc2a580d537a22de7968a8a6e37f29f711470bf61db121faf8"
          },
          {
            "target": "x86_64-unknown-linux-gnu",
            "archive": "herdr-mise-v0.2.0-rc.1-x86_64-unknown-linux-gnu.tar.gz",
            "sha256": "bbcb6ab7cf31216313b42692cbb9a3025cdf35e692787e2340ea13b22e116229"
          }
        ]
      },
      "command_or_action": "npm run perf",
      "result": "NOT_RUN",
      "timestamp": "1970-01-01T00:00:00Z",
      "evidence_ref": "external://NOT_RUN"
    },
    {
      "gate_id": "public-artifact",
      "category": "automated",
      "scope": "full-product",
      "tester": "release-automation",
      "platform": "REPLACE_WITH_MACOS_VERSION_AND_ARCH",
      "executed_against": {
        "tag": "v0.2.0-rc.1",
        "version": "0.2.0-rc.1",
        "commit": "85440d6577ab12a8c087c1c0919d896503164dc3",
        "artifacts": [
          {
            "target": "aarch64-apple-darwin",
            "archive": "herdr-mise-v0.2.0-rc.1-aarch64-apple-darwin.tar.gz",
            "sha256": "e4cf8c06845a8fe764042b38816004aa4e23e5abed209f2245ea3b00ec2b9b57"
          }
        ]
      },
      "command_or_action": "On macOS only, run scripts/verify-public-artifact.sh for the accepted RC aarch64-apple-darwin archive and checksum URL using version 0.2.0-rc.1, then hold scripts/acceptance-soak.sh start against that verified install for the twelve-hour minimum elapsed run",
      "result": "NOT_RUN",
      "timestamp": "1970-01-01T00:00:00Z",
      "evidence_ref": "external://NOT_RUN"
    },
    {
      "gate_id": "live-supported-herdr",
      "category": "automated",
      "scope": "full-product",
      "tester": "release-automation",
      "platform": "REPLACE_WITH_OS_AND_ARCH",
      "executed_against": {
        "tag": "v0.2.0-rc.1",
        "version": "0.2.0-rc.1",
        "commit": "85440d6577ab12a8c087c1c0919d896503164dc3",
        "artifacts": [
          {
            "target": "aarch64-apple-darwin",
            "archive": "herdr-mise-v0.2.0-rc.1-aarch64-apple-darwin.tar.gz",
            "sha256": "e4cf8c06845a8fe764042b38816004aa4e23e5abed209f2245ea3b00ec2b9b57"
          },
          {
            "target": "x86_64-apple-darwin",
            "archive": "herdr-mise-v0.2.0-rc.1-x86_64-apple-darwin.tar.gz",
            "sha256": "bad9caf8073a9bfc2a580d537a22de7968a8a6e37f29f711470bf61db121faf8"
          },
          {
            "target": "x86_64-unknown-linux-gnu",
            "archive": "herdr-mise-v0.2.0-rc.1-x86_64-unknown-linux-gnu.tar.gz",
            "sha256": "bbcb6ab7cf31216313b42692cbb9a3025cdf35e692787e2340ea13b22e116229"
          }
        ]
      },
      "command_or_action": "cargo test --locked feed::tests::stub_socket_selects_live_mode -- --exact",
      "result": "NOT_RUN",
      "timestamp": "1970-01-01T00:00:00Z",
      "evidence_ref": "external://NOT_RUN"
    },
    {
      "gate_id": "startup-recovery",
      "category": "automated",
      "scope": "full-product",
      "tester": "release-automation",
      "platform": "REPLACE_WITH_OS_AND_ARCH",
      "executed_against": {
        "tag": "v0.2.0-rc.1",
        "version": "0.2.0-rc.1",
        "commit": "85440d6577ab12a8c087c1c0919d896503164dc3",
        "artifacts": [
          {
            "target": "aarch64-apple-darwin",
            "archive": "herdr-mise-v0.2.0-rc.1-aarch64-apple-darwin.tar.gz",
            "sha256": "e4cf8c06845a8fe764042b38816004aa4e23e5abed209f2245ea3b00ec2b9b57"
          },
          {
            "target": "x86_64-apple-darwin",
            "archive": "herdr-mise-v0.2.0-rc.1-x86_64-apple-darwin.tar.gz",
            "sha256": "bad9caf8073a9bfc2a580d537a22de7968a8a6e37f29f711470bf61db121faf8"
          },
          {
            "target": "x86_64-unknown-linux-gnu",
            "archive": "herdr-mise-v0.2.0-rc.1-x86_64-unknown-linux-gnu.tar.gz",
            "sha256": "bbcb6ab7cf31216313b42692cbb9a3025cdf35e692787e2340ea13b22e116229"
          }
        ]
      },
      "command_or_action": "cargo test --locked feed::tests::missing_source_then_live_source_replaces_demo_atomically -- --exact",
      "result": "NOT_RUN",
      "timestamp": "1970-01-01T00:00:00Z",
      "evidence_ref": "external://NOT_RUN"
    },
    {
      "gate_id": "source-loss-reconnect",
      "category": "automated",
      "scope": "full-product",
      "tester": "release-automation",
      "platform": "REPLACE_WITH_OS_AND_ARCH",
      "executed_against": {
        "tag": "v0.2.0-rc.1",
        "version": "0.2.0-rc.1",
        "commit": "85440d6577ab12a8c087c1c0919d896503164dc3",
        "artifacts": [
          {
            "target": "aarch64-apple-darwin",
            "archive": "herdr-mise-v0.2.0-rc.1-aarch64-apple-darwin.tar.gz",
            "sha256": "e4cf8c06845a8fe764042b38816004aa4e23e5abed209f2245ea3b00ec2b9b57"
          },
          {
            "target": "x86_64-apple-darwin",
            "archive": "herdr-mise-v0.2.0-rc.1-x86_64-apple-darwin.tar.gz",
            "sha256": "bad9caf8073a9bfc2a580d537a22de7968a8a6e37f29f711470bf61db121faf8"
          },
          {
            "target": "x86_64-unknown-linux-gnu",
            "archive": "herdr-mise-v0.2.0-rc.1-x86_64-unknown-linux-gnu.tar.gz",
            "sha256": "bbcb6ab7cf31216313b42692cbb9a3025cdf35e692787e2340ea13b22e116229"
          }
        ]
      },
      "command_or_action": "cargo test --locked service::tests::source_loss_and_restore_serves_a_fresh_authoritative_snapshot -- --exact",
      "result": "NOT_RUN",
      "timestamp": "1970-01-01T00:00:00Z",
      "evidence_ref": "external://NOT_RUN"
    },
    {
      "gate_id": "connected-no-agent",
      "category": "automated",
      "scope": "full-product",
      "tester": "release-automation",
      "platform": "REPLACE_WITH_OS_AND_ARCH",
      "executed_against": {
        "tag": "v0.2.0-rc.1",
        "version": "0.2.0-rc.1",
        "commit": "85440d6577ab12a8c087c1c0919d896503164dc3",
        "artifacts": [
          {
            "target": "aarch64-apple-darwin",